,posts
338,Xiaomi accidentally uses Apple video to advertise controversial Mimoji phone (Mi CC9)
339,Emergency cell phone alerts could be a hotspot for hackers
340,Huawei users getting advertisements on their lockscreens (xpost /r/huawei)
341,Australian Communications Media Authority (ACMA) releases NBN wi-fi modem study.
342,"Android Bluetooth stack modifications to improve audio quality on headphones without AAC, aptX, or LDAC codecs (merged into LineageOS and others)"
343,Saturday APPreciation (Jun 29 2019) - Your weekly app recommendation/request thread!
344,Got a tech question or want to discuss tech? Weekly /r/Technology Tech Support / General Discussion Thread
345,Xiaomi Mi 9T/Redmi K20 review
346,Vegebot Farm Robot Uses Machine Learning To Harvest Lettuce
347,"MSI App Player Brings Android to the Big Screen - Powered by BlueStacks, now supports up to 240FPS"
348,The Sony Walkman turns 40 years old today - AA batteries powered the world's first successful portable music player
349,Let's talk about bezels.
350,Google May be Working on a Foldable Smartphone with Multiple Displays Acting as Pages
351,WhatsApp facing server side issues all over the world
352,Terrorism crackdown laws could give greater power to block Australians from websites | World news
353,Tesla Says Deliveries in Quarter Set a Record
354,"Google Home 2.12 hints at dark theme, device 'YBD' codename, Android TV transfer [APK Insight] - 9to5Google"
355,FedEx refuses to deliver a Huawei phone to the US
356,"Tips for potential Huawei buyers from a new Huawei Mate 20 and ex-Google Pixel and One Plus owner. TLDR: It's an INCREDIBLE device (if configured right), and possibly the best possible time to buy Huawei devices. x-Post from r/Huawei"
357,Under-screen 3D cameras could truly kill the display notch
358,OnePlus 7 Pro In A Box - Leaving The Apple Ecosystem
359,OnePlus 7 Pro camera review: Average at best
360,We’ve resolved the issue affecting some users when updating to Beta 4 and we’re resuming updates. All enrolled devices will receive a new Beta 4 update to QPP4.190502.019 (even those with Beta 4 QPP4.190502.018 installed). We’ve also updated downloadable images for developers.
361,New Dridex malware strain avoids antivirus software detection
362,[DISCUSSION] Here's an old forgotten feature that I'd REALLY like to see re-implemented in future updates
363,The Worm That Nearly Ate the Internet
364,"Just got my Zenfone 6, ama"
365,Facebook evacuates four buildings after possible sarin exposure
366,Spotify’s ‘Your Library’ Refresh: What You Need to Know — Spotify
367,Google's Pixel C Android tablet may not get any more security updates
368,EMUI 10 based on Android Q: First Look on the Huawei P30 Pro
369,"U.S. may outlaw messaging encryption used by WhatsApp, iMessage and others: report."
370,Google's internal Android Q Beta bug testing group blew up last night for some reason
371,US smartphone users know little about own phones
372,I have found a guaranteed fix for blurry instagram stories!
373,Jony Ive ‘dispirited’ by Tim Cook’s lack of interest in product design: WSJ
374,VW’s crazy electric car breaks F1 record at the Goodwood Festival of Speed
375,Google and Facebook under scrutiny over UK ad market dominance
376,"HP, Dell, other tech firms plan to shift production out of China: Nikkei"
377,Ebooks Purchased From Microsoft Will Be Deleted This Month Because You Don't Really Own Anything Anymore
378,"""Realme first announced a sample of the 64MP camera, which comes from the ISOCELL Bright GW1 released by Samsung not long ago, but the mobile phone has not yet released. Another competitor is Redmi. This photo is 16MB with a resolution of 9216×6912!"""
379,"Based on recent leaks, the Pixel 4 will likely have an upside-down display panel"
380,Install Substratum custom themes on Samsung Galaxy phones on One UI
381,'Adults don't get it': why TikTok is facing greater scrutiny | Technology
382,"Ice Universe: ""These renderings are a bit exaggerated, especially the chin, which is actually only a little smaller than the S10+."""
383,Electric cars grab almost half of sales in oil-producing Norway
384,Facebook mailing facility evacuated because of suspected bioterrorism attack
385,"Tetris Royale, a 100-player battle royale, is coming to mobile devices"
386,Microsoft Issues Warning For 800M Windows 10 Users (Registry No Longer Backing Up by Default)
387,Pixel 4A ?
388,"Archival footage, audio immerses viewers in Apollo: Missions to the Moon"
389,[Discussion] The Future of Google and Android
390,Xiaomi has started fixing those annoying rampant Ads on the MIUI interface
391,I kept my Galaxy S8 G950U (US Variant) in my freezer and got a multi-core score equivalent to that of the Exynos variant.
392,It is now possible to overclock the Xiaomi Mi9's screen to 84Hz
393,Fingerprint sensor automatically learns
394,"Huawei assures continued security updates, warranty support, and access to 'world of apps' for Honor phones in UK; confirms Android Q update for Honor 20 series"
395,"Tencent, Xiaomi And Oppo Testing Huawei's '60% Faster' Android OS, Report Claims"
396,University of Chicago Medical Center selling private patient information to Google without patients' consent
397,A Look At The AMD Zen 2 Core
398,Samsung Completes Folding Phone Redesign After Screen Failures
399,Server image mystery in Georgia election security case
400,New Galaxy Fold reportedly has an 8-inch display with S Pen
401,Librechair — The Lawnchair fork that aims to respect your freedom
402,Move to square icons?
403,How important will blockchain be to the world's economy?
404,[Review] Samsung Galaxy S10E
405,iOS 13 Eye Contact Correction Makes it Look Like You're Staring Directly Into the Camera
406,MOQI i7s Android game console review
407,[DEV] I released my first Calculator App and hope to know your opinion about it
408,"Xiaomi Won’t Launch New Mi Max, Mi Note Phones This Year, CEO Lei Jun Says | Technology News"
409,What's Going On With Hangouts?
410,"A piece of Windows 10 is now running on WebAssembly, natively on iOS and Android"
411,Moronic Monday (Jul 01 2019) - Your weekly questions thread!
412,"GrapheneOS, an open source privacy and security focused mobile OS with Android app compatibility (started by Daniel Micay, CopperheadOS creator)"
413,Bitcoin 'uses as much global energy as Switzerland'
414,Motorola Sucks &amp; You Shouldn't Buy Their Phones
415,Huawei has a chance to get its smartphone business back on track. It won't be easy
416,Robots for the elderly must be designed with care and respect
417,Mozilla: No plans to enable DNS-over-HTTPS by default in the UK
418,Redmi K20 Pro (Mi 9T Pro) | a notchless Mi9 with a bigger battery? (The Nitpicker)
419,Samsung Galaxy S10 catches fire while charging
420,"Supply of DRAM, NAND &amp; Displays Could Be Disrupted by Japan &amp; South Korea Dispute"
421,Motorola One Vision review: An affordable 21:9-screen handset with good cameras Review | ZDNet
422,"Google Camera 6.3 preps 'McFly mode,' selfie tips, and Pixel 4 support [APK Insight]"
423,"This call center company relies on a workforce of incarcerated women to help companies like Microsoft, SAP, and Dell power their customer support"
424,Android co-founder Andy Rubin accused of cheating wife out of fortune while running a sex ring
425,Reinventing Firefox for Android: a Preview
426,Using CRISPR to eliminate HIV
427,5 reasons to not delay your digital transformation
428,Waymo can now shuttle passengers in its self-driving cars in California
429,Good people of /r/technology. It is time to take a stand.
430,"Vivo Z1 Pro is official: Snapdragon 712, 5,000mAh battery and hole-punch display for ₹14990 ($217)"
431,Snapdragon 865 Will Support LPDDR5 And On-Chip 5G Claims Tipster
432,Brave defies Google's moves to cripple ad-blocking with new 69x faster Rust engine
433,Apple will enable you to quickly change wifi networks from the control center in iOS 13. Google removed this feature starting from Pie
434,Xiaomi caught ripping off an artist’s work — including art commissioned by LG
435,The Pixel 4 is shaping up to be a Huawei Mate 20 Pro by Google - The Verge
436,"Startup packs all 16GB of Wikipedia onto DNA strands to demonstrate new storage tech - Biological molecules will last a lot longer than the latest computer storage technology, Catalog believes."
437,How exactly does Gmail handle retrieving outside images?
438,The $199 PineBook Pro Linux Laptop Gets An Awesome Privacy Feature And July Pre-Order Date
439,Instagram will test a feature that allows users to shadow ban their bullies.
440,Huawei nova 5 Pro images show off quad camera and a waterdrop notch display - GSMArena.com news
441,BOE will start mass production of LCD displays with Optical Fingerprint Scanner
442,Hearables Will Monitor Your Brain and Body: Devices tucked inside your ears will make technology more personal than ever before
443,"France wants to fine Facebook over hate speech - The measure would force companies to remove content within 24 hours, and was approved by the lower house of the French Parliament Thursday"
444,Bogus “Aggression Detectors” Are Audio-Recording People In Public
445,Waymo gets green light in California to pick up passengers in self-driving cars
446,"7-Eleven Japan shut down its mobile payment app after hackers stole $500,000 from users"
447,Way to set android chrome groups with labels
448,How long should you keep your phone?
449,How Unpredictable Is Your Subway Commute? We’ll Show You
450,Moronic Monday (Jun 10 2019) - Your weekly questions thread!
451,ICE and the FBI are using facial recognition on driver’s license databases around the US
452,Finally discovered the greatness of glide typing and Gboard
453,Oppo Reno 10X Zoom - Unboxing and First Impressions
454,"Google crowdsource updated with new UI, new icon and more (still no adaptive icon)"
455,LightSail 2 Sends Back 1st Signals from Its Solar-Surfing Test Flight
456,Safer Nuclear Reactors Are on the Way - Resilient fuels and innovative reactors could enable a resurgence of nuclear power
457,Huawei isn't sure about using Android in future phones
458,If android had one or two extra buttons(physical) what will you use them for?
459,How to remove a picture from showing up on peek you website
460,"First Amendment Case Against Section of Digital Millennium Copyright Law Can Proceed, Says Judge"
461,Professor faces 219-year prison sentence for sending missile chip tech to China
462,Scientists are searching for a mirror universe. It could be sitting right in front of you.
463,Machine learning has been used to automatically translate long-lost languages - Some languages that have never been deciphered could be the next ones to get the machine translation treatment.
464,Intel Internal Memo Details Fiercest Challenges Versus AMD In Over A Decade
465,[DEV] NSA Intern - Satirical game about surveillance - Codes for 4th of July!
466,"""Note 10's ""chin"" is very narrow, the same level as the iPhone, no speaker grooves on the forehead, which means that the flagship Sound on Display(SoD) technology will replace the traditional speaker. The forehead will be narrower."""
467,Xiaomi isn't impressed with LG's new W lineup of smartphones
468,Android now forces apps to include proprietary code for push notifications
469,Qualcomm Snapdragon 855 Becomes First Mobile SoC to Receive Smart Card Equivalent Security Certification
470,Google's ham-fisted fix for broken screen pinning in Android Q disables it
471,How to unlock the Nokia 2.1 bootloader
472,Zenfone 6 Flip Camera TEARDOWN! - How does it work?
473,D-Link agrees to new security monitoring to settle FTC charges - Agreement settles charges D-Link left users open to critical and widespread threats.
474,"Kiwi Browser adds text reflow support, Translator settings, external download manager support, and more"
475,Facebook outage gave a glimpse at how its AI analyses images
476,Google Photos showing large ‘Photo book store’ ad in app menu
477,New attack creates ghost taps on modern Android smartphones
478,"The OnePlus 7 may look the same, but it's all-new where it counts"
479,Cellebrite Says It Can Unlock Any iPhone (and most widespread Android phones) for Cops
480,What's the deal with Android TV being a second class citizen?
481,Engineer who smuggled US military chips into China faces 219 years
482,Breaking: Huawei allowed to do business with U.S. companies again
483,Search engine and browser choice rolling out to Google Play users in Europe (xpost /r/europe)
484,Google is finally taking charge of the RCS rollout
485,Galaxy M40 First Impressions
486,"Clipboard Everywhere 2.3: FREE Unlimited Clipboard Sync, and More; Copy and Paste across devices"
487,Researchers develop new anti-face-distortion method for wide-angle lenses
488,"What is #SocialMediaStrike? Reddit Tech Joins Protest Against Facebook and Twitter, Shuts Down for 24 Hours"
489,Exclusive: Google appears to have leveraged Android dominance - India antitrust watchdog
490,"Google Camera Coming with Wide-Color Capture Support, Possibly with Google Pixel 4"
491,UK ISP group names Mozilla 'Internet Villain' for supporting 'DNS-over-HTTPS'
492,British Airways faces record £183m fine for data breach
493,Apple Publicly Trolls Google Over Controversial Smart City Surveillance Plans
494,"Future of ""Cloud Computing"" putting servers underwater &amp; powering them up by 100% renewable energy"
495,Amazon vs Walmart Budget Tablet
496,Google appears to have leveraged Android dominance - India watchdog
497,Here is when Samsung is planning to bring the Galaxy Note 10 to the market
498,"T-Mobile, Dish reach divestiture deal, pending DOJ concerns: Sources"
499,Galaxy Fold: Inside Samsung’s struggle to deliver a foldable phone – and why the future of smartphones hinges on it
500,"Rumored specs of 6 cameras in the new Sony Xperia, Max J. on Twitter"
501,Killing Net Neutrality Rules Did Far More Harm Than You Probably Realize
502,The difference between mid-range and flagship SOC is bigger than I thought
503,About that 3.5 mm jack...
504,Y Combinator-backed Project Wren is aiming to make carbon offsets more consumer friendly
505,LAPD pioneered predicting crime with data. Many police don't think it works
506,Samsung US is offering free Galaxy Buds and 1 year of YouTube Premium for any purchase in the S10 or Note 9 line through June 8th (June 30th for just YouTube Premium)
507,New 'Glowing' Google assistant long press UI. Android going back to the HOLO days?
508,Samsung accused of misleading customers on 'water resistance' of Galaxy mobile phones
509,Nvidia reveals new line of ‘Super’ GeForce RTX graphics cards
510,Google's officially done making tablets
511,I designed my own dream smartphone using only photoshop and maybe too much free time
512,Netflix Hangouts - Watch Netflix at work by making it look like you’re on a conference call
513,"Tech tax bombshell: Amazon, Facebook, and Google face tax on revenues"
514,Are phones with SD cards becoming a thing of the past?
515,Amazon Seeks Permission to Launch Satellites to Compete with Musk's SpaceX in Satellite Broadband
516,New Malware campaign ViceLeaker targeting Android Devices: Researchers
517,"One Year After Trump’s Foxconn Groundbreaking, There Is Almost Nothing To Show For It"
518,Catalyst deep dive: The future of Mac software according to Apple and devs
519,Grab a seat and be on time with new transit updates on Google Maps
520,"Google app 10.12 preps Assistant shortcut FAB, Driving Mode [APK Insight]"
521,Unreleased Android Q build leaks customizable ‘Back Sensitivity’ gesture setting
522,"30,000 followers makes you an Internet ""celebrity,"" says UK ad regulator"
523,Google stopped caring about tablets long before the Pixel Slate
524,Chrome/Chromium Browsers show History when holding Back Button
525,"Xiaomi Mi 9T announced: Redmi K20 for Europeans (299€ for the first 24h in June 17 launch for 6/64gb model, 329€ after)"
526,Experiments show dramatic increase in solar cell output
527,At least 57 e-scooters and bikes found at the bottom of Portland river
528,'Smoking gun': Huawei staff employment records link them to Chinese military agencies
529,"Fewer 'Plus' Nokia Phones, Nokia 9 PureView India Launch, and More: What to Expect From HMD Global This Year"
530,"“Updates for Samsung” — from a blog to an Android advertisement revenue goldmine of 10,000,000+ users"
531,Bixby button system navigation for Samsung devices
532,What feature do you wish was built into Android?
533,"Google Messages gets an open beta program, how to join - 9to5Google"
534,Instagram to notify users comments might be offensive before they are posted
535,"Google Pixel 3A XL ""Real Review"" - YouTube"
536,Samsung’s 5nm EUV Technology Gets Closer: Tools by Cadence &amp; Synopsys Certified
537,The official statement from OnePlus regarding the weird notifications on OnePlus 7 Pro
538,Blisteringly Fast Machine Learning On An Arduino Uno
539,Donald Trump confirms US companies can continue to sell to Huawei during G20 press conference
540,'Futurebook' parody site shows a dystopian digital future
541,"GIF-ing you a way to say LOL, haha or jajaja from Google Images"
542,"Scrypted is like Tasker for home automation, integrates with Google Home, Alexa, and HomeKit"
543,Does anybody else feel like their Android enthusiasm might get in the way of actually enjoying phones anymore?
544,The entire Samsung Galaxy S10 lineup is $200 off at B&amp;H Photo
545,[Discussion] Google should tighten the Play store rules and support 3rd party App stores to still give Android the freedom it needs
546,"Hey Google, let’s either do change logs on the Play Store or not"
547,Google Pixel 4 tease: what it means
548,Nubia Red Magic 3: The Gaming Smartphone Of Your Dreams...
549,Immersive branded experiences in YouTube and display ads
550,Pixel 3A is #1 selling unlocked phone Amazon
551,Do you use Gesture Navigation or Navigation Buttons?
552,"Facebook DOWN: Server status latest, users hit by login and images not loading issues"
553,"Broadcom Said to Be in Talks to Buy Symantec, the Security Software Maker"
554,Why phone specs are a huge lie // Nick Ackerman
555,"Nokia 2.2 with Android One, up to 3GB RAM will be the cheapest smartphone to get Android Q"
556,Sliding along on water: environmentally friendly slide bearings with water lubrication
557,Bluetooth devices are breaking Android notifications with duplicate alerts and ignored settings
558,"""Excited to share that our most affordable smartphone, Nokia 1, upgrades to Android 9 Pie starting today. Now there is a Nokia smartphone for everyone running Pie - bringing to you the latest experiences from Google..."" | All Nokia phones are now on Android P"
559,That Figgers F3 phone Flossy was hyping everyone for is literally just an Oukitel u23
560,These gloves turn sign language into audible speech
561,Android Q Quick Settings have hidden and confusing shortcuts
562,SwiftKey can turn you into a cute animal when you message friends
563,Harry Potter Wizards Unite is released for Pre-Registered members
564,Amazon confirms it retains your Alexa voice recordings indefinitely
565,European Companies Look to Build Their Own Walls in the Cloud
566,Mozilla joins brief for protection of LGBTQ employees from discrimination
567,"Google, Microsoft, Amazon and others plan to move production out of China"
568,Lookout is being replaced my McAfee?!
569,Apple CEO Tim Cook says report on tensions with Jony Ive is ‘absurd’
570,[Exclusive Leak] Motorola One Pro Press Renders; Phone to Be Announced Soon
571,"DOJ expands its Boeing 737 Max probe to the Dreamliner, report says"
572,What did everyone think of the Apple Keynote today?
573,The Week in Tech: Can You Put a Price on Your Personal Data? - The New York Times
574,"The OnePlus 7 Pro Review: Outstanding Performance &amp; Screen, Adequate Everything Else"
575,What ever happened to Assistant integration with Messages?
576,"A fake Joe Biden campaign site is being run secretly by a Trump campaign operative, a new report revealed on Saturday"
577,A third of Amazon employees predict website crash on Prime Day - Business Insider
578,Researcher Prevent Hearing Loss in Mice With Refined Gene-Editing Tool
579,"Volkswagen will share electric car platform with Ford, says Reuters"
580,Sony Xperia 1s / 1v May Debut on July 9 in Japan
581,Why wouldn't Huawei use ARM emulation on top of an open-source CPU architecture?
582,"Schools Are Using 'Aggression Detecting' Mics That Are Set Off By Coughing, Slamming Locker Doors To Head Off The Next School Shooting"
583,Android Police: 25 things Apple announced for iOS 13 that we want on Android
584,"Google Pixel 3a review: It's plastic, and it's fantastic"
585,"Exclusive: Google Pixel 4 Renders Reveal Square Camera Bump, No Physical Fingerprint Scanner"
586,"Hacker who launched DDoS attacks on Sony, EA, and Steam gets 27 months in prison"
587,Failure to separate phone volume from emergency alert volume may now become a reliability for Android operating systems
588,Review: Samsung has Massively Improved the Galaxy S10’s Low-Light Camera Quality Since Launch
589,Samsung Mobile Security | Android Security Updates
590,"Asus 6Z Launched in India Starting at Rs. 31,999 ($459)"
591,AT&amp;T LG V35 ThinQ now receiving Android Pie update
592,Crash Detection Feature Works
593,LG's mobile division is failing and what they should do about it.
594,Magisk v19.3 Released to Stable!
595,T-Mobile to Carry the Samsung Galaxy S10 5G
596,Cyber Warfare Threat Rises As Iran And China Agree 'United Front' Against U.S.
597,An updated Nvidia Shield is in the works and could be one of the flagship Stadia devices
598,"Image recognition, mini apps, QR codes: how China uses tech to sort its waste"
599,Secrets of Chernobyl spill out more than three decades after the nuclear disaster
600,Samsung's Rollable Phone Patent
601,FYI The latest update for T-Mobile S10+ does not include Night Mode camera improvements. This is the second T-Mobile update since Samsung released Night Mode. T-Mobile refuses to answer why they are omitting the camera update from their software updates.
602,The Google Pixel 3a XL Review: Does Mid-Range Make Sense? [AnandTech]
603,"Germany: Backdoor found in four smartphone models; 20,000 users infected"
604,SpaceX Falcon Heavy Rocket Lofts 24 Satellites in 1st Night Launch
605,Audm is a long-form news narration app now available for Android
606,[DEV] DarQ - Per-app selectable force dark option for Android Q (Root required)
607,"Airport Facial Recognition, How Abusers Exploit Basic Apps, and More News"
608,The deadly poison sarin was detected in a mailbag at Facebook's offices in California
609,Frontier customer bought his own router—but has to pay $10 rental fee anyway
610,"[Flossy Carter] Moto G7 Power ""Real Review"""
611,Tracing the Supply Chain Attack on Android
612,Does everyone with screen protector has damaged oleophobic coating?
613,We’re told that too much screen time hurts our kids. Where’s the evidence?
614,Japan restricts tech exports to South Korea over wartime labor row
615,Pixel 4 Leaks &amp; Rumours
616,Thousands of dodgy copycat apps identified in Google Play Store
617,Went from OneUi to Stock Android for a day and was shocked
618,"Intel is auctioning off 8,500 patents as it exits 5G smartphone market"
619,Facebook abused to spread Remote Access Trojans since 2014
620,Join for Firefox may become a reality!
621,The Galaxy A7 is about to receive its third MajorOs Update
622,Bulgarian IT expert arrested after demoing vulnerability in kindergarten software
623,I went to buy a Google Pixel 3A. T-Mobile tried to put me off
624,Red Magic 3 is a real gaming phone for real gamers
625,US wants to isolate power grids with 'retro' technology to limit cyber-attacks
626,King's College London breached GDPR by sharing list of activist students with cops
627,Amazon confirms it holds on to Alexa data even if you delete audio files - ‘The American people deserve to understand how their personal data is being used’
628,Internet wobble caused by Cloudflare glitch
629,Nikola Tesla documents released by the FBI
630,U.S. Meteorologists 'Deeply Concerned' Over 5G Roll-Out
631,More Galaxy Note 10 case renders leak - 3.5mm headphone jack nowhere to be found
632,What's your favorite Android manufacturer?
633,"Netflix could lose almost a quarter of its subscribers if it started running ads, study shows"
634,"Ethics in the Age of Artificial Intelligence - If we don’t know how AIs make decisions, how can we trust what they decide?"
635,"Xiaomi Mi 9 ""Real Review"" The Best Android Phone Under $500?"
636,Samsung Galaxy XCover 4s Images leaked
637,European Net Neutrality is Under Attack
638,Behind Dynamic System Updates in Android Q: How Google is using Project Treble to improve future Android releases
639,"Canadian OnePlus 7 Pro price cut by $100, all models + Cashback for current owners - Android Authority"
640,Saturday APPreciation (Jun 15 2019) - Your weekly app recommendation/request thread!
641,Nice! Google apps splash screens are now adjusted to sunset
642,The complete list of alternatives to all Google products
643,PSA: S9 'Settings keeps crashing'
644,Sunday Rant/Rage (Jun 16 2019) - Your weekly complaint thread!
645,T-Mobile enemy Dish could help save the T-Mobile/Sprint merger
646,AR in Search: A new way to learn - YouTube
647,Some of Amazon and Google's biggest rivals tell the government they're ready to assist antitrust probes
648,Xiaomi Mi CC9e may launch internationally as the Android One Mi A3
649,Blokada new big update!!!
650,Ark Compiler Explained: How Huawei’s App Compiler May Improve Android App Performance
651,Sony Xperia 1 review
652,Xiaomi Accidentally Uses Apple Video to Advertise Controversial Mimoji Phone
653,Zenfone 6 is the first device to have HDR+ Enhanced with 48 MP - Arnova8G2 (GCam modder)
