,posts
0,What happens if a hypersurveillance approach to spying on workers becomes the norm?
1,SpaceX reports milestone for Starlink satellite links — and sparks a debate
2,The chief executive who built up one of the world’s leading mobile money services has died
3,July 2019 security patch is rolling out for Essential Phone
4,"How Amazon and the Cops Set Up an Elaborate Sting Operation That Accomplished Nothing. Behind-the-scenes emails show how Amazon and Ring worked with police in Aurora, Colorado to make people scared of each other."
5,Amazon confirms it keeps your Alexa recordings basically forever
6,Oppo Reno Review(Standard Edition)
7,Galaxy Note10's screen edge curvature is like this @universelce
8,Has anyone completely moved their wallet on to their phone?
9,Lightyear One is a solar car with a range of 450 miles
10,We tested 5G speeds around the world. Here's what we found
11,"I see your RCS takeover google, but how about support for 'free' inflight messaging from the messages app."
12,LG rolls back on V30 Android Pie commitment - NotebookCheck.net News
13,Dr Mario for Mobile out July 10th
14,What do you think of having the Product Sans font everywhere?
15,Motorola Moto Z4 review: lost in the crowd
16,"Auto-delete controls for Location History start rolling out today on Android and iOS, making it even easier for you to manage your data"
17,A Bitter End For Regular Joe? Scientists Engineer A Smooth Beanless Coffee
18,Xiaomi Mi 9’s latest MIUI beta adds “3D Air Gestures” to launch apps
19,Data breach at cloud solution provider PCM
20,Valve's Dota Underlords (standalone of the popular Auto Chess mod) — open beta on Android in about a week
21,Android Q(&amp;A): Android Engineers take us on a deep dive of Android Q
22,"Tesla Model 3 Breaks World EV Distance Record — 2,781 km (1,728 miles) Travelled In 24 Hours"
23,"Electric cars 'will not solve transport problem,' report warns - Car use will still need to be curbed even when all vehicles are powered by clean electricity, a report has said."
24,Asus ZenFone 6 | I like it a lot more than I want to (TheNitpicker review)
25,Samsung Galaxy S10 Exynos 9820 versus Snapdragon 855 Gaming Performance Comparison
26,Why life-saving improvements to car safety have benefited men more than women
27,Just got RCS roll out in the UK
28,"Almost 50 Percent of New Cars Sold in Norway Are Fully Electric, Tesla Model 3 Tops the List"
29,[PSA] Regular OnePlus 7 has no rounded corners.
30,Google Flags Hundreds of Pirate Sites for 'Abusive Experiences'
31,Google killing its tablets in 2019 is as shortsighted as it was in 2016
32,Harvard's RoboBee X-Wing Flies Using Solar Power
33,"""Pictures here are one of the proof, that HMD is unwilling to provide bootloader unlock, or not prepared for bootloader unlock at the beginning. You can try to unpack your own logo partition from ES2/CO2 if you're interested."" - Hikari Calyx"
34,"Google’s Jigsaw Was Supposed to Save the Internet. Behind the Scenes, It Became a Toxic Mess - Google’s internet freedom moonshot has gotten glowing attention for its ambitious projects. But current and former employees, leaked documents, and internal messages reveal a grim reality."
35,Redmi K20 Pro Vs ZenFone 6 Camera Comparison
36,Private DNS solution for Android versions below Pie!
37,Is the CRAZY Flip Camera Fragile? - Zenfone 6 Durability Test!
38,"Huawei Testing Russia's Aurora OS As Complete Android Replacement, Report Claims"
39,Nova Launcher 6.1.11 is now a stable release. Choices of 3 different colors for Night Mode including a solid black color for all of you that have requested it! New way to remove home screens to make it easier and of course bug fixes.
40,Reliance partners with Facebook to launch literacy program for first time internet users in India
41,We’ve already built too many power plants and cars to prevent 1.5 ˚C of warming
42,FK (franco.kernel) kernel manager is temporarily free.
43,Roku Stretches Lead As #1 Streaming TV Platform in US After Record Q1 Performance
44,"OmniVision Announces Its First 48 Megapixel, 0.8 Micron Image Sensor"
45,PSA to anyone using USB c phones that stopped charging for no reason
46,WhatsApp 'deleting 2m accounts a month' to stop fake news | Technology
47,"True multi-day battery life, the Blackview BV9500 Pro"
48,Autosync for Google Drive can replace the outgoing Photos sync functionality
49,"'Nokia Ion Mini' prototype, an unreleased compact Android phone from pre Microsoft acquisition era, surfaces on eBay"
50,Mozilla starts test of subscription-based ad-free Internet experience
51,Google Duo tests Google Home calling and call reminders
52,‘Fingerprinting’ to Track Us Online Is on the Rise. Here’s What to Do.
53,Elizabeth Warren accuses advisory panel for FCC of corruption
54,Kernel sources released for the Redmi K20 Pro and 5G Xiaomi Mi Mix 3
55,Changing how Google Drive and Google Photos work together
56,"With a single wiretap, police collected 9.2 million text messages | TechCrunch"
57,Huawei P30 Pro Camera Review: Proof that Huawei's ban hurts innovation
58,Google Assistant sound is almost the same as the Xbox achievements one.
59,FreeDOS turns 25 years old: An origin story
60,Cloudflare stutters and the internet stumbles
61,Chinese border guards put secret surveillance app on tourists' phones
62,What happened to Android from Sept. to Dec. 2018?
63,Xiaomi shows off its under-display camera technology too.
64,AMD and Samsung's GPU Licensing Deal: A New Era of Collaboration?
65,Half of Americans Have No Idea What Phone They’re Using
66,D-Link agrees to new security monitoring to settle FTC charges
67,"KKR has acquired Corel (including its recent acquisition Parallels), reportedly for $1B+"
68,"Huawei P30 Pro update (EMUI 9.1.0.178) adds DC Dimming, lower latency Bluetooth streaming, and more"
69,OnePlus 7 Pro Is The Best Smartphone Overall
70,OnePlus 7 Pro vs. Galaxy S10+ - PhoneBuff Battery Test
71,OxygenOS 9.5.7 for OnePlus 7 Pro - OnePlus Community
72,Broadcom in advanced talks to buy Symantec
73,Dualshock 4 Support in Android Q
74,"Firefox Preview v1.0.1 is out, makes it easier to swipe to close tabs, and other minor fixes."
75,"OnePlus 7 Pro Now Starts at $899CAD, $669USD"
76,Samsung Galaxy A30 review
77,Google should buy Tile
78,List of removed features?
79,"Facebook and Twitter have not been invited to White House social media summit, sources say"
80,How do you organize your phone's apps? (Android)
81,Puffin OS - Next-generation technology to bridge the digital divide
82,Rants: Google Tasks / Google Calendar / Google Keep / Google Assistant / REMINDERS
83,Google Duo now lets you message photos directly to contacts
84,YouTube tests hiding the comments section by default on Android
85,Galaxy S9 gets dedicated camera Night mode with the latest update!
86,"Android Central Podcast Mentioned That At Google IO, They Heard ""Android Team, Views The Pixel Team, As An Independent Vendor"""
87,Google Files app updated for dark mode
88,Galaxy Fold release may just be a few weeks away now
89,"Automatic parking card is back, now in Google Assistant's ""updates"" tab (not sure if on Google beta only)"
90,Juste got RCS roll out in France
91,The OnePlus 7 Pro's gorgeous display is its best and worst feature
92,How secure is my data in Android 9 really after theft or seizure?
93,"In moments of anger, Steve Jobs was highly critical of Tim Cook, says biographer Walter Isaacson"
94,Xiaomi threatens writers over Mimoji app's overlap with Apple's Memoji
95,"Andy Rubin: ""Thanks. We'll make an announcement. Hang tight."""
96,"Heads up: some Pixel 2 users are reporting failed beta 4 updates, forced to factory reset."
97,Microsoft's Your Phone Companion adds a OneDrive Play Store link to your direct share menu if it isn't installed
98,From Ballots To Term Sheets: The Startups Born Out Of The Obama Campaign
99,"Sony Xperia 1 stock running low in Europe, the Purple color seems the most popular"
100,Flow Desktop for Android progress update! X post r/android_beta
101,Asus 6Z (Zenfone 6) vs OnePlus 7
102,"vivo Z1 Pro debuts with Snapdragon 712, 32MP selfie cam and 5,000 mAh battery"
103,U.S. government staff told to treat Huawei as blacklisted
104,Huawei P30 series reaches 10 million sales in 85 days
105,Sunday Rant/Rage (Jul 07 2019) - Your weekly complaint thread!
106,"Google app getting full dark mode for Search, Assistant, and in-app Discover feed [APK Download]"
107,Qualcomm Used Patent Monopolies To Shake Down The Entire Mobile Phone Industry For Decades
108,I finally switched to Firefox
109,The “neuropolitics” consultants who hack voters’ brains - MIT Technology Review
110,HTCs software update experience
111,"Detecting quark nuggets, a candidate for extreme ball lightning and dark matter"
112,The Result of OnePlus 7 Pro Camera Blind Test
113,World's First [manned] Quad-Copter Race Held At Goodwood 2019
114,Why logistics scenarios matter for the future of the industrial IoT
115,House lawmakers officially ask Facebook to put Libra cryptocurrency project on hold
116,Google news latest update adds a new bottom themed article view
117,Microsoft's Your Phone app can now mirror your Android phone's notifications to your Windows 10 PC
118,QR Code Scanning added to Galaxy S10 family Camera
119,It’s not that we’ve failed to rein in Facebook and Google. We’ve not even tried - The tech giants use our data not only to predict our behaviour but to change it. But we can resist this attack on democracy
120,Bill Gates says his ‘greatest mistake ever’ was Microsoft losing to Android
121,There and Back Again: An Android User's Tale
122,TikTok under investigation over child data use
123,Olixar Olixar Note 10 and Note 10 Pro cases may show presence of a headphone jack
124,Xiaomi is ending MIUI Global Beta for all devices after this month
125,"Hyundai announces ""world's first"" Continuously Variable Valve Duration engines"
126,Bloomberg: Galaxy Fold redesign is complete
127,New Nvidia Shield TV running Android 9 Pie pops up in Play Console device catalog
128,France moves to make companies block hate speech online
129,Xiaomi will no longer develop MIUI betas for budget Redmi smartphones
130,LG V50 (Verizon’s Newest 5G Phone) Arrives June 20
131,Inside Huawei’s secretive plans to develop an operating system to rival Google’s Android
132,Endless AI-generated spam risks clogging up Google’s search results
133,Google App Changed
134,Sony Xperia 1 review: An extra-tall order
135,The Intrinsic Flaws in Google Stadia - And Other Streaming Services
136,Android Q beta 5 to introduce new Assistant gesture hint and animation
137,This Phone has a LASER PROJECTOR built in?! [JerryRigEverything]
138,Toyota testing improved solar roof for electric cars that can charge while driving
139,Android Security and Pixel Update bulletins Published
140,What should Android 10 Q be called?
141,Protective film for the Note 10 leaked
142,"7-Eleven Japan shut down a mobile payments app after only two days because hackers exploited a simple security flaw and customers lost over $500,000"
143,Gates Says Steve Jobs Cast ‘Spells’ to Keep Apple From Dying
144,We went behind the scenes with the OnePlus camera team. Here's what we learned. - Android Authority
145,Cat flap uses AI to punish pet's killer instincts
146,Chinese thermal coal demand to fall with launch of new power transmission line
147,Cloudflare Global Disruption
148,Google killing 'Google Pay Send' in the UK later this year
149,LA’s earthquake warning system worked — just not how people expected
150,Walmart's new $65 Onn Tablet is better than you’d think
151,"Facebook, Whatsapp &amp; Instagram facing grave technical issues across the globe."
152,A subreddit named after Donald Trump has been quarantined. Does that mean anything at all? A misnomer may lead non-Redditors to believe that the platform is actually doing something about radicalisation.
153,Google App notification bug over Bluetooth seems to fixed (finally)
154,Greed Is to Blame for the Radicalization of YouTube and Facebook | WIRED
155,Want a More Affordable Android Phone. The OnePlus 7 Pro Is Cheaper Without (Many) Sacrifices
156,Samsung CEO calls Galaxy Fold ‘embarrassing’
157,"Redmi 7A With Snapdragon 439 SoC, 12-Megapixel Camera Launched in India"
158,The Google Assistant is now available in Waze
159,"Android Q Beta 4 finally organizes the Share menu alphabetically, with suggested apps on top"
160,Android q beta 4 got snooze notifications again
161,File-storage app 4shared caught serving invisible ads and making purchases without consent
162,I found this image form Chinese server here's some information about Huawei's new operating system
163,Netizen Report: Preventing bias or protecting extremism? Debunking the new US Senate proposal for Silicon Valley
164,Xiaomi's latest MIUI 10 Beta brings a redesigned settings and new password manager
165,Murder suspect identified by DNA database has now been convicted
166,"Wikipedia co-founder slams Mark Zuckerberg, Twitter and the ‘appalling’ internet"
167,Court convicts murder suspect found through a DNA database - It's believed to be the first case solved through the method that went to trial.
168,Nokia Daredevil will come with Night Mode camera option
169,Helping businesses capture their identity with Google My Business
170,Looking for a walking app that simulates walking around the world
171,Google Chrome to block heavy ads that use too many system resources
172,Wikipedia’s “Constitutional Crisis” Pits Community Against Foundation
173,"Last year, the /r/Android community helped me with my research, here are the published results. Thanks r/Android!"
174,"Ryuk, Ryuk, Ryuk: Georgia’s courts hit by ransomware"
175,Andrew Little's well justified rage at Google over Grace Millane case court order
176,Android 9 Pie is rolling out to Nokia 3 (2017)
177,Motorola cancels Android Pie for Moto Z2 Force on all carriers in the US except Verizon
178,"WhatsApp Positively Affects Our “Quality Of Relationships”, Says Study"
179,"Shall we strip price caps from .org, mulls ICANN. Hm, people seem really upset... OK, let's do it"
180,ASUS ZenFone 6 vs. OnePlus 7: Which should you buy?
181,Google may add a new gesture in Android Q to deal with Screen Pinning
182,Nokia 3 sets a record by getting Android 9 Pie
183,"Email Tracking Is Creepy and Invasive and No One Should Do It - The rise of email ""tracking pixels"" is a dystopian nightmare that shows a complete lack of empathy for the person you're talking to."
184,"In light of Samsung Galaxy's 10th anniversary, here is my Galaxy S10 review!"
185,Samsung’s Galaxy Fold might not ship until after the Note 10
186,These release notes are pathetic.
187,"Grubhub says its contract allowed it to create fake restaurant websites - A default opt in, if you will"
188,A.I.’s Minority Report for retail: They know you’ll return it even before you buy it
189,King of the cloud: Andy Jassy - the rock fan behind Amazon's most profitable business
190,Facebook may be 'pivoting' to something worse
191,What would Steve Jobs think of today's Apple?
192,Phone Water Cooling is REAL! But does it work? [LinusTechTips]
193,Android Q Beta 4 system images are live
194,Updates in Maps and Search to help during times of crisis
195,India's latest Google probe sparked by junior antitrust researchers
196,"Build, flash and boot AOSP on Beryllium (Poco F1 / sdm845) running mainline (v5.2-rc7) kernel"
197,Gboard Enter Key shape change
198,238 Google Play apps with &gt;440 million installs made phones nearly unusable
199,Tim Wu Explains Why He Thinks Facebook Should Be Broken Up
200,Redmi K20/K20 Pro to launch in India on July 17th
201,"Google working on ‘Fast Share,’ Android Beam replacement and AirDrop competitor [Gallery] - 9to5Google"
202,China cracks down on podcasts and audio apps
203,T-Mobile Oneplus 7 Pro update 3.5.7 arrived today.
204,Chinese-authored spyware found on more than 700 million Android phones
205,Philly Park Officials Criticized for Installing Devices That Blare High-Frequency Noise at Young People
206,"40 years ago, the Sony Walkman changed how we listen to music"
207,GeckoView in 2019 – Mozilla Hacks - the Web developer blog
208,"[DEV] I've made ""Should I Wait?"", a free app to show if a movie has after credits scenes!"
209,Security flaws in a popular smart home hub let hackers unlock front doors
210,Fake noise will be added to new electric cars starting today in the EU - A safety feature for pedestrians
211,How to support open-source software and stay sane
212,ICANN eliminates .org domain price caps despite lopsided opposition
213,$150 Off Pixel 3 and 3XL Sale on Google Store (UK Only)
214,Microsoft developer reveals Linux is now more used on Azure than Windows Server
215,play youtube audio from console on android
216,How apps power Hong Kong's 'leaderless' protests
217,"Big Tech Regulation Exposes Google Investors, CEO Sundar Pichai's Future"
218,Mrwhosetheboss reviews the redmi k20
219,Asus ROG Phone 2 confirmed to feature 120Hz display
220,HMD's Chief Marketing Officer Pekka Rantala leaves the company
221,Glass on the back of the phones should be replaced with ceramic or go back to the metal back ages
222,Should We Give Google Our Health Care Data?
223,Microsoft is seeking to join Linux private security board
224,fuchsia / zircon (was megenta) what it means for android
225,Lenovo Z6 goes official with Snapdragon 730 SoC and a triple camera
226,"More than 1,000 Android apps harvest data even after you deny permissions"
227,Facebook is tweaking its News Feed algorithm to curb bogus health claims
228,"Boxed in by Chinese rivals, Samsung to sack 1,000 in India"
229,Thank you Google.....
230,"French Protesters Block Amazon Sites over Climate, Jobs"
231,These are the sneaky new ways that Android apps are tracking you
232,Why Google’s surprise Pixel 4 tease raises the stakes - The Verge
233,Let's talk about animations and Android app ecosystem.
234,Here’s a reality check on NASA’s Artemis Moon landing program
235,"How a lawsuit could reveal secrets about Silicon Valley’s favorite philanthropic loophole - Today’s “working robber barons” have used a tax break to create a $110 billion charity stockpile, called donor-advised funds. It isn’t getting any smaller."
236,Sony Xperia L3 review
237,Secret Border Patrol Facebook group is brimming with hate – TechCrunch
238,23% of Subscribers Would Drop if Netflix Had Ads
239,OnePlus 7 Pro review: The best Android phone value of 2019
240,Galaxy Fold 5G model has picked up necessary pre-launch certifications
241,Google Photos - Dark Mode
242,Possible solution to big phone problems: a touchpad on the back
243,Huawei can buy from US suppliers again — but things will never be the same
244,Microsoft's Bill Gates: Steve Jobs cast spells on everyone but he didn't fool me
245,VW’s Type 20 is an electrified dream of its iconic campervan
246,Brave Improves Its Ad-Blocker Performance by 69x with New Engine Implementation in Rust
247,Google was never really serious about tablets
248,Xiaomi CC 9 vs iPhone Xs: Selfie cameras
249,Huawei makes the best $99 wireless earbuds you can’t buy in the US
250,OnePlus 7 Pro owners received bizarre spam notifications during a failed internal test
251,[Android] Smartphones with high refresh rate displays
252,We're opening forums for Nintendo Switch Android hacking - XDA Developers
253,Introducing USBaudio (to forward audio from Android devices)
254,New Sony J8010 'Sphinx' Xperia due to launch imminently
255,Stadia Founders Edition Up For Preorder
256,No launcher?
257,EFF and OTI Respond to the UK Government’s Online Harms White Paper
258,"Gmail API changes are about to break apps like SwiftKey, SMS Backup+, Nine, and Kiwi for Gmail"
259,Mario creator Miyamoto counters cloud gaming hype
260,Huawei’s export ban is wider in scope than most people imagine
261,"The Meizu 16s is a no-notch, no-nonsense flagship phone"
262,Android Patch Brings Bluetooth SBC Codec Audio Quality on-par with aptX
263,"Samsung's updated A-series phones are coming to the US, starting at $179.99"
264,Instagram Accounts are Exploiting the Sudan Crisis - The Atlantic
265,"Google directing people to extreme content and conspiracy theories, Sky News finds - There are calls for Google to address the YouTube search engine algorithm which is accused of ""pushing people down rabbit holes""."
266,"In Android Q, why are the Notification Shade and Setting black in dark mode, yet all Google apps are dark grey?"
267,"'We all suffer': why San Francisco techies hate the city they transformed - San Franciscans have long complained that tech workers ruined their city, driving up rents and homelessness and eliminating diversity. Now even the tech workers agree."
268,Hans Zimmer designed the sound for BMW’s futuristic concept car
269,Researchers have eliminated HIV in mice for the first time. Is a cure for humans next?
270,Firefox is reinventing its Android app to undo Chrome's monopoly
271,US Cyber Command issues alert about hackers exploiting Outlook vulnerability
272,Android Q may let you switch cards from Google Pay in the power menu
273,"Gartner: ""On-premises is the new legacy"" in databases"
274,What should I buy Thursday (Jul 04 2019) - Your weekly device inquiry thread!
275,Where is LG at right now?
276,How much will they raise the price of the Pixel 4a?
277,"Goodbye, tablets: Their marketshare keeps sinking"
278,The Era of Live Starts Now: Galaxy A80 Available Today
279,"""India is considering developing and using a chat application similar to WhatsApp and other homegrown secure communication networks, at least for government agencies."""
280,Tesla delivered a record number of cars in the second quarter
281,Brazil to add digital data protection to fundamental rights
282,Warning: free hotel wifi is a hacker’s dream - Hotel systems are so leaky it’s worth investing in your own virtual private network
283,"RDP BlueKeep exploit shows why you really, really need to patch."
284,My friend and I both had Chat features available in Messages settings on Telus (Canada)
285,"[MrMobile] A Day On A 5G Phone: Fast, But Finicky"
286,Oppo to announce phone with under-display selfie camera at MWC19 Shanghai: rumour
287,The FCC approves Ossia’s Cota wireless AA battery charging tech
288,Firefox's Ad-Free Premium Browser Will Cost $4.99 a Month
289,FCC grants Verizon’s request to waive the handset unlocking rule they’ve been subject to as a Block C licensee (PDF) - xpost r/verizon
290,"Pixel 4, Please Have a Flat Display"
291,Tired of Google following you? It is now easier to clear location data | Technology
292,French lawmakers approve 3% tax on online giants
293,Logistic firms urged to adapt to tech trends
294,The only good dark mode implementation is in the news app
295,"Honor, Huawei and Apple are the msot reliable smartphone brands according to the french retail group Fnac-Darty (based on 130k+ after-sale interventions)"
296,Asus ZenFone 5z gets updated with May 2019 security patch
297,What technology will be more important for the future of delivery services?
298,"Robocalls are not only annoying — there’s an entire dirty industry behind them, FTC reveals"
299,Hubble Space Telescope Captures Slow-Motion Stellar 'Fireworks' Display
300,Google tests new Instagram style effects in Messages
301,welcome to post-reality: apple will now fake your eye contact in facetime
302,Official LineageOS 16.0 is now available for the OnePlus 6
303,"Samsung Galaxy M40 Debuts With Infinity-O Display, Screen Sound Tech"
304,"Citing ‘massive risks,’ House Democrats ask Facebook to halt its cryptocurrency plans"
305,China Is Forcing Tourists to Install Text-Stealing Malware at its Border - VICE
306,Think twice before giving results of your home DNA kit to the police
307,AIs Named by AIs
308,Google denies talks with Dish on creating new major U.S. carrier
309,"7-Eleven Japanese customers lose $500,000 due to mobile app flaw"
310,Samsung's Response to Chinese Phones
311,Galaxy S11 probably won't have a headphone jack either
312,Superhuman (email client) is Spying on You - even if you don't use it.
313,Nubia Red Magic 3 - 2 weeks of use review
314,"Amazon keeps what you ask Alexa forever unless you delete it, so here’s how"
315,"Facebook, Instagram and Whatsapp are 'being buggy,' users report Outages around the world"
316,The $349 Galaxy A50 Is Samsung's Pixel 3a Killer with Bigger Screen and 3 Cameras
317,We should stop measuring screen size in term of diagonal
318,"Vivo’s Super FlashCharge tech fills a 4,000mAh phone in 13 minutes"
319,Google begins showing British Android users rival search engines to appease EU regulators
320,"OnePlus 7 Pro - Limited Edition “Almond"" - YouTube"
321,Into the Dark - Google Design
322,Microsoft’s new Windows 1.11 app is a Stranger Things trip back to 1985 - A nostalgic tour of Windows 1.0
323,Sunday Rant/Rage (Jun 23 2019) - Your weekly complaint thread!
324,Why are phones so good but batteries are still so terrible?
325,Camera night mode
326,HTC announces U19e and Desire 19+ mid-rangers
327,Galaxy Tab S5 Benchmarked with 6 GB Ram and (probably) Snapdragon 855
328,"Facebook’s image outage reveals how the company’s AI tags your photos - ‘Oh wow, the AI just tagged my profile picture as basic’"
329,Wi-Fi Easy Connect is Android Q's alternative to WPS
330,How the Mi9T proves that the Pocophone F2 is coming
331,Motorola has let me down for the last time
332,"I get the feeling Android is turning into an advertisement platform, after using an old iPhone for a few days,"
333,I Opted Out of Facial Recognition at the Airport—It Wasn't Easy
334,Deepfake revenge porn distribution now a crime in Virginia
335,Future Factory: How Technology Is Transforming Manufacturing
336,How would broken-up tech giants be structured to be viable ?
337,TechTablets Redmi K20 Pro (Mi 9T) Video Unboxing &amp; Review
