,posts
978,[Seizure Warning] Editing reviews on the Google Play Store leads to flashing screen. (Android Q Beta)
979,"""Limiting my OnePlus 6 to use 4GB of RAM is yielding some very interesting results. I'm more convinced than ever that 6GB should be the MINIMUM for a flagship."""
980,Heads Up! Google Pay Now Wants a Copy of Your Govt Issued Photo ID...
981,The Next Big Thing..
982,Google tweaked algorithm after rise in US shootings
983,These ‘Men in Black’ Think Aliens Made Your iPhone
984,Fake Samsung firmware update app tricks more than 10 million Android users
985,"Google is working on an automatic white balance adjustment feature like Apple’s True Tone, possibly for the Pixel 4"
986,New Google beta 10.0.5.21 appears to have fixed notification sounds on media channel that bypass DND
987,Who here's dailying the oldest phone and still happy with it?
988,This solar array expands itself at the right temperature – TechCrunch
989,The robots are definitely coming and will make the world a more unequal place: New studies show that the latest wave of automation will make the world’s poor poorer. But big tech will be even richer
990,"No, ""AMOLED Black"" Does NOT Save More Battery Than Dark Gray"
991,What should I buy Thursday (Jun 13 2019) - Your weekly device inquiry thread!
992,WARNING! - BxActions Flagged as a Trojan Virus
993,Facebook’s new Study app pays adults for data after teen scandal
994,PlayStore recommending installing other search engines and browsers
995,Palm Phone now available unlocked for use on all major US carriers (except Sprint)
996,Google Internet Balloon Spinoff Loon Still Looking for Its Wings
997,Nokia 4.2 review: Performance issues spoil another budget Nokia phone
998,Top VPNs secretly owned by Chinese firms
999,"Following Mozilla's lead, Microsoft pushes Edge onto anti-tracking bandwagon"
1000,"TV Panel Prices Plunge in June, with No Signs of Stopping in July, Says TrendForce"
1001,Equinix and GIC Forming Billion Dollar Data Center Venture in Europe
1002,It’s Okay to Use Public WiFi. You Don’t Need a VPN.
1003,AI Simulates The Universe And Not Even Its Creators Know How It's So Accurate
1004,"Xiaomi Mi 9T Review: Xiaomi's ""uppest"" mid-range"
1005,Become a Stadia “founder” with our first collection of games
1006,How to use this $70 gadget to detect spy cameras in your Airbnb or hotel room
1007,Fierce neutron star collision shows how fast the universe is expanding
1008,"Florida City Fires IT Employee After Paying $460,000 Bitcoin Ransom to Hackers"
1009,Google is reportedly arguing that cutting Huawei off from Android threatens US security
1010,"Google Voice 2019.26 adds Material Theme avatars, preps 'Driving Mode' - 9to5Google"
1011,'A public relations nightmare': Ticketmaster recruits pros for secret scalper program
1012,"Facebook, Instagram and other platforms experiencing issues worldwide"
1013,MxPlayer updated with PiP support (Android 8.0+)
1014,Wireless Earbuds: Jabra Elite 65 vs Samsung Galaxy Buds (non-pro review)
1015,The world's first railway electrification system and electric tram were invented by Ukrainian Fyodor Pirotsky
1016,"Japan Curbs Exports to South Korea, Hitting Global Chip Makers"
1017,Social media strike proposed for July 4-5 by Wikipedia co-founder
1018,Electronic Frontier Foundation calls out Slack on retention policies – how does Teams compare?
1019,Unregulated facial recognition technology presents unique risks for the LGBTQ+ community
1020,"RealWear raises $80M from Teradyne, Qualcomm, others for industrial augmented reality headset"
1021,Show me your wallpaper and widget layouts !
1022,"Samsung Galaxy S10 series outsells the S9 generation, S10+ is the most popular model - GSMArena.com news"
1023,"1,800 teens and 20-somethings reveal what’s cool and what’s not in 2019"
1024,Google tests Verified SMS and SMS Reminders in Messages
1025,"The drawer behavior is changing. Users will be able to open the drawer by peeking the drawer, and then swiping. Big benefit is that this works with existing apps with ""old"" DrawerLayout versions. (from r/GooglePixel)"
1026,OPPO will show a prototype phone with an under-screen selfie camera on 26th June at the MWC in Shanghai
1027,The Moto Z4 is tragically boring and behind the times
1028,Google Pixel 3A Teardown! - Sufficiently Simple
1029,"I just got the Xiaomi Mi 9t , ask me anything. (I will do tests too)"
1030,"Project Mainline for Android Q: What it is, what it isn&amp;#039;t, and how it works"
1031,Google Trips app is discontinued 5th of August.
1032,[Pixel 3a XL] Disappointing front camera quality (xpost /r/GooglePixel)
1033,Moronic Monday (Jun 24 2019) - Your weekly questions thread!
1034,"Asus 6z with Flip camera, Snapdragon 855 launched in India starting at Rs 31,999 (~$460 USD)"
1035,Elon Musk says free self-driving chip upgrade could come to older Teslas this year
1036,"Xiaomi announces Mi CC, the new smartphone series under its Mi brand"
1037,Former Equifax executive sentenced to prison for insider trading prior to data breach - Four months of jail time
1038,YouTube's don't recommend channel option.
1039,Sunday Rant/Rage (Jun 09 2019) - Your weekly complaint thread!
1040,"FBI, ICE find state driver’s license photos are a gold mine for facial-recognition searches"
1041,"This ""COULD"" be the best feature of Android Q - wireless desktop mode"
1042,Theranos founder Elizabeth Holmes to stand trial in 2020
1043,Difference in number of installs?
1044,Spotify shuts down direct music uploading for independent artists
1045,"Am I the only one excited for a flat note 10, to be the proper successor to the legendary note 4!"
1046,"Guide:[Root] Call Screen outside US/Canada (Pixel 2, 2XL, 3, 3XL, 3a, 3aXL)"
1047,Another Trade War: Japan To Tighten Export Rules For High-Tech Materials To South Korea
1048,"‘Prospective Threat’ of Chinese Spying Justifies Huawei Ban, U.S. Says"
1049,Sony Xperia 1 review: a tall order [The Verge]
1050,"New Solar + Battery Price Crushes Fossil Fuels, Buries Nuclear"
1051,Galaxy Unpacked 2019 (Note 10) date announcement:
1052,Google Warns of Microsoft SwiftKey Losing Access to Gmail on July 15
1053,Amazon is adding a new tab to highlight live television to its Fire TVs
1054,A Foldable Microsoft Surface That Runs Android Apps Coming in 2020
1055,[Dave Lee] The OnePlus We Loved Is Dead
1056,LightSail 2 sends its first signals back to Earth
1057,The best phones for LineageOS | androidpolice
1058,Pixel's Night Sight moving to main Google Camera UI - 9to5Google
1059,Asus 6z (Zenfone 6) is launching on 19th June in India
1060,Exclusive: First photos of Google Pixel 4 spotted in the wild
1061,What Phone are you currently using? Are you satisfied with it?
1062,Saygus has been evicted from their building
1063,Samsung bags Qualcomm Snapdragon 865 chip orders ahead of TSMC
1064,Family Link - great tool for parents
1065,"PH retailers support Huawei, to refund devices if they can't run Google apps"
1066,What should I buy Thursday (Jun 27 2019) - Your weekly device inquiry thread!
1067,"Google may be making new ""Aware"" music control gestures for the Pixel 4"
1068,"Thumbs Down to Facebook’s Cryptocurrency — Only a fool would trust Facebook with his or her financial wellbeing. But maybe that’s the point: with so much personal data on some 2.4 billion monthly active users, who knows better than Facebook just how many suckers are born every minute?"
1069,Endless AI-generated spam risks clogging up Google’s search results - A ‘tsunami’ of cheap AI content could cause problems for search engines
1070,5% of Broadband Users Likely to Cut the Cord in the Next 12 Months
1071,Study suggests Russian social media trolls had impact on 2016 election
1072,Apple to Shift Assembly of Mac Pro From US to China
1073,What have you done to break your phone to the point that it was unfixable?
1074,What are your favorite renditions of the Android logo?
1075,OnePlus 7: Way Under the Radar!
1076,Pixel 4 teaser photo signals a whole new Google
1077,This Chrome extension lets you disguise Netflix as a Hangout to slack off at work
1078,Apple Analysts Haven’t Been This Pessimistic Since 2004
1079,Google Maps gets an on-screen speedometer while driving
1080,Toshiba WD NAND Production Hit By Power Outage: 6 Exabytes Lost
1081,"Why so much “science” used in design is bullshit: Android, Losada and Frankfurt."
1082,"Two years after Essential’s launch, still no Home hub or second phone"
1083,"Bought the oneplus 7(not pro). If you are thinking of buying the same and have questions, ama."
1084,"Amazon is 25 – let’s burst its birthday balloon: Until it pays the true cost of what it sells to us, we should think twice before buying from the online giant."
1085,Police face calls to end use of facial recognition software | Technology | The Guardian
1086,"ASUS is sending the ZenFone 6 to developers from TWRP, LineageOS, and more"
1087,Moto Z4 vs. Pixel 3a XL: Which should you buy? | Android Central
1088,Tracing the ARPANET Roots of the Internet’s Cybersecurity Crisis
1089,Amazon staff will strike during Prime Day over working conditions.
1090,A look inside neural networks
1091,"Google Photos product lead confirms manual face tags, timestamp edits on Android, and other features in the works"
1092,Could ‘fake text’ be the next global political threat?
1093,Cloudflare outage caused by bad software deploy (updated)
1094,Florida city fires IT employee after paying ransom demand last week
1095,SpaceX is in communication with all but three of 60 Starlink satellites one month after launch
1096,Latest Instragram update seems to finally add a janky version of the slide-in animation from the iOS version
1097,Sunday Rant/Rage (Jun 30 2019) - Your weekly complaint thread!
1098,"Amazon sellers are bribing users with cash and gift vouchers for five-star reviews, investigation reveals"
1099,"Have any phone software execs ever been asked the ""updates make phones worse"" question?"
1100,Gmail’s ‘dynamic email’ will be available to everyone July 2nd
1101,Is This Our First Look At Samsung's Revolutionary Galaxy S11?
1102,First-ever malware strain spotted abusing new DoH (DNS over HTTPS) protocol
1103,Spotify Stations is finally available in the US
1104,"Your eyes are the key to distracted driving, not your brain. Relying on peripheral vision is the problem, not the cognitive load of multitasking."
1105,The Dream Smartphone! (2019) - YouTube[MKBHD]
1106,Australia gets its own Net Neutrality debate
1107,Your Data Could Be at the Center of the Fight Against Big Tech
1108,"Microsoft Closes The Book On Its E-Library, Erasing All User Content"
1109,You're going to pay more for .org and .info domains following ICANN's lifting of price caps
1110,Saturday APPreciation (Jul 06 2019) - Your weekly app recommendation/request thread!
1111,"Cyber-incident reports from UK finance sector spiked by 1,000% in 2018"
1112,Elon Musk's SpaceX Satellite Plan Mars Astronomers' View of Stars
1113,"Lawnchair 2.0-2130 adds desktop lock and choosing icons from the gallery, tests app categorization and adaptive brightness theming"
1114,AMOLED Notification App (NotifyBuddy).. Missing your old LED notification?
1115,The downfall of the virtual assistant (so far)
1116,Asus Zenfone 6 test [GER] / Asus ZenFone 6 im Test @ Computerbase.de
1117,"Google still keeps a list of everything you ever bought using Gmail, even if you delete all your emails"
1118,'The Definition of Corruption': Warren Calls Out FCC Advisory Committee Overrun by Corporate Suits
1119,5 Ways 5G Will Change Your Life
1120,We've got Android on the Nintendo Switch: Here's what it can do
1121,At a Glance widget using all device calendars
1122,Microsoft's Ebook Apocalypse Shows the Dark Side of DRM
1123,"With Apple's new offline ""Find My iPhone"" feature, why can't Google implement it on all Android devices via Google Play Services?"
1124,"Chrome 76 Beta: dark mode, payments, new PWA features and more"
1125,Method for collecting two electrons from each photon could break through theoretical solar-cell efficiency limit
1126,Firefox Preview 1.0.0 released.
1127,All the countries where someone managed to shut down the entire internet — and why they did it
1128,Need for speed: how much faster are modern phone processors ( Old flagship processors vs new mid-range processors ).
