,posts
654,"Human: Fall Flat is a chaotic physics-based puzzle game, and it just landed on Android"
655,"Samsung Electronics is working on its next generation 'clamshell' type foldable phone likely with 6'7"" primary and 1"" secondary displays"
656,Motorola Promises Only One OS Update for Moto Z4...
657,5G doesn't just need to be fast – it needs to be free
658,"Howard Jones returns with Transform: ""I believe that technology has always driven music forward"""
659,"Google Messages v4.4 prepares reminder notifications and federated learning, expands Assistant to attachments [APK Teardown]"
660,Some Facebook Menlo Park buildings evacuated after possible sarin exposure in mailing facility
661,"""German authorities have fined Facebook 2 million euros ($2.3 million) for under-reporting complaints about illegal content on its social media platform in breach of the country’s law on internet transparency"""
662,U.S. Plans to Limit India’s H-1B Use Due to Localized Data Storage
663,Samsung Note 10 thoughts
664,Phone Comparisons: ASUS ZenFone 6 vs OnePlus 7
665,WhatsApp tests feature that shares your status to Facebook and other apps
666,Google Stadia exec isn’t worried about data caps—but he probably should be
667,"""Under-display camera technology will take a long time to mature. In the second half of this year, the (size of hole on) rigid Super AMOLED will be on the stage of history, with a size of 3.x mm, and will continue to shrink this number until 1mm in the next 1-2 years."" - IceUniverse"
668,Play Store v15.2.38 brings back the new Material interface [APK Download]
669,Phone Area's Pixel 4 edited if the forehead is as big as the Pixel 2 XL
670,Google Pay is now live for RBC Royal Bank (of Canada) clients
671,5G | Expectations and use-cases for industrial companies
672,"Canonical GitHub account hacked, Ubuntu source code safe"
673,"US troops in Afghanistan will soon test a tiny, pocket-sized drone in the field - The 82nd Airborne is figuring out how to best use FLIR’s tiny helicopters"
674,"LG launches the W Series with LG W10, W30, and the W30 Pro in India"
675,The best Android launchers for enhanced efficiency
676,"AMD and Samsung Announce Strategic Partnership in Ultra Low Power, High Performance Graphics Technologies"
677,Phone App Search...
678,Xiaomi pushed an OTA update that bricks some Mi 9 SE devices
679,New Chrome Protections from Deception
680,Xiaomi fires employee who used artist’s work without permission
681,Can I buy a phone that doesn’t use anything from Google or Apple? | Technology | The Guardian
682,Google's Project Soli radar chip could debut in Google Pixel 4
683,"Xiaomi Mi Band 4 with 0.95-inch AMOLED color display, voice assistant, 50-meter water resistance announced"
684,"""Sony is working on a competitor to the Galaxy Fold and Mate X. The current prototypes features: 3220mAh, SM7250 SoC, LG Display, Nautilus Design, 10x Zoom Camera. The retail models may feature: Snapdragon 855 SoC, Qualcomm X50 Modem"""
685,"Poll: Full Gestures, Buttons, or a Combo Approach?"
686,Moronic Monday (Jun 17 2019) - Your weekly questions thread!
687,Juan Bagnell on Why Galaxy S10e is not for HIM?
688,How can this phone last 16 days?? [LinusTechTips]
689,Samsung Galaxy Note 10 Release Upgrade
690,A laksa-making robot chef prepares the dish in just 45 seconds: Sophie the Robotic Chef can make about 80 bowls of delicious laksa within one hour
691,"Yes, the robot dog ate your privacy"
692,Quad Bayer sensors: what they are and what they are not
693,OnePlus 7 Pro vs. Samsung Galaxy S10+
694,"Victory: Somerville, Massachusetts Stands Up to Stop Face Surveillance"
695,San Francisco joins the fight to make Uber and Lyft drivers employees
696,Google Maps tests a new alert for when your taxi goes off route
697,[Invitation] Samsung Galaxy UNPACKED 2019: The Next Galaxy
698,YouTube has altered me
699,Huawei's IP Update Shows Why US Critics Are Scared
700,Boeing's 737 Max Software Outsourced to $9-an-Hour Engineers
701,UK launches investigation into Facebook and Google for dominating digital advertising
702,Why would anyone NOT want the stock Android?
703,If Android was closed sourced.
704,Pixel 4 dimensions and display size via onleaks
705,Camera Night mode for Galaxy Note 9 arrives with latest monthly update
706,Sony Xperia 1 Review (GSMArena)
707,"""HMD Global will store Nokia smartphone user data only on servers in Finland from now on. Starting with the Nokia 4.2."""
708,"Android Circuit: First Look At Galaxy S11, Note 10 Pro Leaks, Google Confirms Disappointing Pixel 4"
709,Amazon: Carbon emissions from our Australian bit barns aren't for public viewing
710,"I just got an internal ""Googlers-only"" July update pushed to my Pixel 3a XL"
711,Steve Wozniak Warns People to Get Off Facebook Over Privacy Concerns
712,Huawei Technologies’ Links to Chinese State Security Services
713,Ruha Benjamin: ‘We definitely can’t wait for Silicon Valley to become more diverse’ | Technology
714,Switching a Xiaomi Mi Mix 2s to LinageOS (Android 9)
715,Beeboom // Gcam is the real camera king
716,"The bigger they are, the harder they fall — WeWork and Uber’s fight against reality"
717,Google play store presents alternative browsers to chrome when I just opened the app.
718,BlackBerry devices unaffected by Triada malware
719,Oppo unveils the world’s first under-screen selfie camera
720,An Inside Look at Google Earth Timelapse
721,Streaming TV is about to get very expensive — Here’s why
722,A journalist's wrecked MacBook keyboard tells a terrible story
723,UAE debuts the world's largest individual solar power project
724,Xiaomi is finally adding an app drawer and app shortcuts in MIUI Launcher [APK available]
725,"Boeing 737 Max's Autopilot Has Problem, European Regulators Find"
726,An Android User's Journey on iOS
727,"[Android Q] API classes have updates in Android Q to support fast connection establishment capabilities to Wi-Fi Direct using predetermined information shared via a side channel, such as Bluetooth or NFC."
728,60% bitcoin hasn’t moved in year despite 220% price bump in 2019
729,It’s not that we’ve failed to rein in Facebook and Google. We’ve not even tried | Shoshana Zuboff | Opinion
730,Saturday APPreciation (Jun 22 2019) - Your weekly app recommendation/request thread!
731,Your ideal messenger app
732,MIUI Camera app confirms Xiaomi is working on a phone with a 64MP camera
733,Nokia’s strategy for breaking into the US market is to attack the low end
734,An Online Preschool Closes a Gap but Exposes Another
735,Apples Sign in Option will be available on Android and Windows too.
736,FCC wants to expand robocall ban to foreign calls and texts
737,PSA: Gaming with an XBOX controller works absolutely amazing!
738,Easy rooting really shouldn't have to be a selling point
739,Redmi K20 Pro vs One Plus 7 Pro vs Mi 9 - Flagship Killer Battle!
740,Five schemes for cheaper space launches—and five cautionary tales
741,Samsung Galaxy M20 got android pie earlier than expected!
742,Amazon can be held liable for third-party seller products: U.S. appeals court
743,Fish replacement may be the next big wave in alternative protein development
744,Leading European institutions partner with IBM to accelerate joint research and educational opportunities in quantum computing
745,Huawei patents a new foldable smartphone design
746,"Google confirms that advanced backdoor came preinstalled on Android devices (Leagoo M5+ and M8, Nomu S10 and S20)"
747,Insane 5G speeds means you may hit your data cap in a flash
748,Foxconn exec complains about not being able to change Wisconsin plans whenever it wants
749,Google denies working on touchscreen tech for Chinese fighter jets
750,"postmarketOS: two years of sustainable phone OS concept (alpha, boots on ~100 Android phones)"
751,Is agriculture ripe for a Tesla moment?
752,Are the flagship devices worth it in your opinion?
753,"For Facebook Content Moderators, Traumatizing Material Is A Job Hazard"
754,Skai could be the first fuel cell-powered flying taxi
755,VizibleZone wants to make pedestrians more visible to autonomous cars
756,New Raspberry Pi 4 VLI Firmware Lowers Temperature by 3-5°C
757,OnLeaks: Galaxy Note10 Pro renders
758,"Weekend discussion: let's talk about the small things, for instance what flagships still have an excellent notification LED? Which have excellent cellular signal, call quality and built-in automatic call recording?"
759,[DEV] I updated my notification app Unnotification to be an overall notification manager app
760,Huawei P30 Pro charging speed tested: 40W Supercharger can take phone from zero to 50% in under 20 minutes
761,"Delhi HC restrains Asus Technology from selling mobile phones, accessories under ZEN, ZENFONE trademarks"
762,Google Camera code hints the Google Pixel 4 may have a telephoto lens
763,What should I buy Thursday (Jun 20 2019) - Your weekly device inquiry thread!
764,My Best and Worst First Experience With Android on Razer Phone 2
765,"Spray-on nanofiber ""skin"" may revolutionize burn and wound care"
766,Scrcpy v1.9 (screen-mirroring app) released
767,Germany and the Netherlands form a joint military network
768,Apple effectively has a monopoly on fixing your iPhone. There’s now a fight to change that.
769,Cloudflare outage brings down websites including Down Detector
770,The Samsung Galaxy Fold saga has felt like a bad Kickstarter
771,"Any form of threatening, harassing, or violence / physical harm towards anyone will result in a ban"
772,OxygenOS Open Beta 35 for the OnePlus 5 and Open Beta 33 for OnePlus 5T (The Last Open Beta for the 5/5T)
773,How to Find Non-Google AMP Web Pages
774,ZTE Axon 10 Pro | (not) a worthy Axon 7 successor? (The Nitpicker)
775,Google Pixel 4 Leaked Model Hands On - Unbox Therapy
776,Motorola P50 key specifications confirmed ahead of launch
777,British Airways faces $230 million fine over data theft
778,Got a Realme X two days ago
779,OnePlus was leaking user emails in its 'Shot on OnePlus' wallpapers app
780,It's Back! Sweet Home Wifi Picture Backup has an update on the play store.
781,Wish message notifications would disappear after I've replied to them in the notification.
782,These Superbug-Fighting Viruses Are Making A Comeback
783,The purpose of a Space Force is a spacefaring economy
784,DeepMind wants to teach AI to play a card game that’s harder than Go
785,Artifical intelligence helps to identify bat species that are suspected of carrying Nipah virus in Kerala - Firstpost
786,"Spotify, Apple Music and rivals are secretly fixing your mainstream taste in songs"
787,Apple CEO Tim Cook says report calling Jony Ive’s departure contentious is absurd
788,The Week in Tech: What Should Your City Do if It’s Hit by Ransomware?
789,The First Sony Walkman Was Released 40 Years Ago Today
790,AI created 3x as many jobs as it killed
791,Amazon Minnesota warehouse workers planning Prime Day strike
792,UK's largest police forensics lab paid ransom demand to recover locked data
793,Ajit Pai's Silence on Phone Tracking Abuse Is Further Eroding Faith in His Competence
794,Nerdy OnePlus camera resolution comparison
795,You can now try apps inside the Google play store before installing them
796,Can you be liable for defamation for what other people write on your Facebook page? Australian court says: maybe
797,HTC is holding an event next week: What will it announce?
798,Gesture navigation madness
799,What should I buy Thursday (Jun 06 2019) - Your weekly device inquiry thread!
800,Easy-to-make thermal chameleon fades into the background
801,Waymo is now allowed to transport passengers in its self-driving vehicles on California roads
802,[Exclusive] This is what the Motorola One Action looks like
803,Equinix and Singapore’s GIC Will Launch a $1 Billion Joint Venture to Build Hyperscale Data Centers in Europe
804,Galaxy S10 Exynos camera and Night Mode significantly improved in May update
805,The Lightyear One is a prototype ‘solar car’ with 450 miles of range
806,MIUI 10's Digital Wellbeing update brings the ability to set App Limits
807,China is building a floating train that could be faster than air travel | World Economic Forum
808,"Telegram 5.8: Adding Contacts Without Phone Numbers, Location-Based Chats and More"
809,Google Maps to start predicting crowdedness on public transport
810,Google and the University of Chicago Are Sued Over Data Sharing - The New York Times
811,Users shouldn't have to disable battery optimization for basic app features to work. Google should implement stricter rules to ensure platform restrictions compliance from developers.
812,What you need to know about Josh Hawley's war on Big Tech
813,India's richest man's telecom network partners with Facebook to launch literacy program for first time internet users in India
814,Will WPA3 come to existing phones updated to Android Q?
815,Google joins Dish Network in talks to create 4th mobile carrier
816,Amazon plans nationwide broadband—with both home and mobile service
817,Samsung Galaxy S10 and S10+ now available in Cardinal Red color
818,London police’s face recognition system gets it wrong 81% of the time
819,"A third CRISPR baby may have already been born in China - Another genetically edited baby is due, but the world may never learn of its birth if the Chinese government decides to keep it a secret."
820,OnePlus Flagship Smartphone Camera Test: OnePlus 7 Pro v. Samsung Galaxy S10 Plus v. Xiaomi Mi 9 v. Huawei P30 Pro
821,Samsung Galaxy A80 review
822,Samsung will release a Galaxy A Smartphone with a SD855!
823,"WTF, Microsoft?"
824,NPM Inc settles union-busting complaints on third try – after CEO trolled for ordering internal mole hunt
825,Researchers crack open Facebook campaign that pushed malware for years
826,Inside the mind of the visionary who pioneered wireless power transmission
827,Google Pay and PayPal expand their integration to give merchants more ways to accept payments online
828,Croatian startups are bigger than you think
829,"How Amazon and the Cops Set Up an Elaborate Sting Operation That Accomplished Nothing - Behind-the-scenes emails show how Amazon and Ring worked with police in Aurora, Colorado to make people scared of each other."
830,Android Q won't automatically reconnect to Wi-Fi networks you manually disconnect from
831,"Another feature I wish we had on Android: You can now potentially find your iPhone even if it is not connected to the internet, by using using crowd‑sourced location."
832,"Happy 10th birthday, Samsung Galaxy"
833,"""Samsung China engineers said that the Note 10 camera will use a three-stage variable aperture: f1.5/ f1.8/ f2.4"""
834,"Android Pie: How to remove the ""Change Keyboard"" function on your Navigation Bar (Solved)"
835,Facebook downgrades posts that promote miracle cures
836,iOS 13 will fix the FaceTime eye contact problem: Fake eye contact for improved intimacy
837,"Somerville, Massachusetts Becomes The Second US City To Ban Facial Recognition Tech"
838,DPReview TV: Google Pixel 3 Review (for photographers)
839,"Magisk Running on Android Q Beta 4, Pixel 3 XL (Logical Partition Support)"
840,New rule means electric cars must make noise
841,Why you shouldn't rush to buy a 5G phone
842,Xiaomi Mi 9T Review: The Commoditization Of Cutting-Edge Smartphone Tech
843,"“Your Pixel C will get applicable security updates until June 2019. After that, we can't guarantee more updates."""
844,Preservationists Are Racing to Save Ouya's Games Before They Disappear
845,Point of customization?
846,Asus ZenFone 6 Review: a flippin' bargain at $500
847,Samsung shuts down its AI-powered Mall shopping app in India
848,'We're anti-influencer': Ice cream truck makes Instagram 'stars' pay double
849,Secure email provider Tutanota launches free encrypted calendar.
850,Privacy-first browsers look to take the shine off Google's Chrome
851,Samsung accused of misleading Australian customers in its advertising about the water resistance of Galaxy phones
852,Superhuman is Spying on You
853,How a childhood of anger led the founder of 8chan to create one of the darkest corners of the internet
854,"Enabling Revolutionary Nondestructive Inspection Capability: DARPA seeks tunable gamma ray tech for host of national security, industrial, and medical applications"
855,HTC financials show signs of life with best result in six months
856,"If you did the Mannequin Challenge, you are now advancing robotics research"
857,Walmart and giant US retailers turn up heat on Amazon and Google by calling for blockbuster antitrust investigation
858,Sting Catches Another Ransomware Firm — Red Mosquito — Negotiating With “Hackers” — ProPublica
859,Exclusive: Google Pixel 4 XL Renders Reveal Dual Selfie And Triple Rear Cameras
860,Lenovo Smart Clock vs Google Nest Hub: Which is better for the bedroom?
861,Lawnchair v2 updated with folders on drawer
862,"In the age of deepfakes, could virtual actors put humans out of business?"
863,Deutsche Telekom first to market in Germany with limited 5G rollout
864,"Xiaomi Mi CC9 is here with 32MP front camera, Snapdragon 710 chipset"
865,Pick your own path - welcome to what might be the future of television
866,Kirin 810 SoC outperforms Snapdragon 855 in AI benchmarks and Snapdragon 730 in early antutu and geekbench benchmarks.
867,June 2019 Pixel Factory Images are live!
868,"Drag-and-drop data analytics | System lets nonspecialists use machine-learning models to make predictions for medical research, sales, and more."
869,Oppo’s MeshTalk lets you call and chat without Wi-Fi or cellular networks
870,"comma.ai, openpilot - Open source driving agent for the transform your modern car to a self-driving car."
871,Filtering and Blocking
872,Moto Z4 Real Review. Those mods looks really cool withh this phone!
873,Huawei is sending developers requests to publish on its app store
874,YouTube deleted 130 rap videos at the request of police who are fighting street gangs responsible for thousands of stabbings
875,From the Editor's Desk: Google's looming Pixel 4 disappointment | Android Central
876,"Amazon Alexa keeps your data with no expiration date, and shares it too"
877,OP 7 PRO Prices!
878,"Google, buyers of your products are not test subjects."
879,Show off your customization thread
880,Saturday APPreciation (Jun 08 2019) - Your weekly app recommendation/request thread!
881,"Amazon Seeks Permission to Launch 3,236 Internet Satellites"
882,Xiaomi is recruiting beta testers for the Mi 9’s Android Q-based MIUI update
883,Zenfone 4 ZE554KL Android Pie update released and then revoked.
884,Samsung Galaxy Tab A 8.0 2019 specs and renders surface
885,WABetaInfo: It’s 2019 and we’re still in 2014
886,Images will no longer automatically sync between Google Drive and Photos starting in July
887,LG Stylo 5 review: A passable Galaxy Note alternative if you're short on cash
888,Mole-Mapping App Miiskin Uses AI To Help Adults Detect Warning Signs Of Melanoma
889,How to enable DNS-over-HTTPS (DoH) in Firefox
890,How Indian IT Workers Discriminate Against Non-Indian Workers
891,Realme takes a few swings at the Redmi 7A
892,Malwarebytes fixes Windows Defender deactivation bug in Windows 10 1903
893,"The world is not ready for ""DeepNude"""
894,Employee Activism Is Alive in Tech. It Stops Short of Organizing Unions.
895,Gboard spoken punctuation improvement?
896,Dispute between Japan and South Korea may cause supply issues for Samsung - SiliconANGLE
897,Ad Blocking
898,Mozilla’s Latest Research Grants: Prioritizing Research for the Internet
899,Android and backups discussion. What options do we have?
900,A BFF in Space! Bioprinter Will 3D-Print Human Tissue on the Space Station
901,Xiaomi Mi 9T/Redmi K20 review [GSMArena]
902,What's your favorite Android Q feature so far?
903,"Judgment Day Looms for Amazon, Apple, Facebook and Google"
904,ASUS ZenFone 6 review: The phone for selfie-obsessionists and Android purists
905,What Magisk Modules are you using on your rooted phone?
906,'Destiny 2' year two winds down with Moments of Triumph starting July 9th
907,Maxine Waters threatens Facebook’s cryptocurrency plans
908,Engineer faces 219 years in prison for smuggling US military chips to China
909,YouTube’s ‘instructional hacking’ ban threatens computer security teachers
910,"Next Sony smartphone will have lots of cameras, eight in total"
911,"Manage your Android with Broken\Dead Screen, Mirror Screen on PC, enable USB Debugging, remove locked screen, backup [Like a PRO]"
912,Gmail for Android starts getting first bits of dark mode
913,Huawei will be allowed to do business with U.S. companies again.
914,FCC proposal would let it punish international robocallers
915,every single Google app for Android that has a dark mode puts the setting to turn it on in a different place
916,The new name for Spotify's app is... Interesting.
917,"LineageOS Changelog 23 - Brilliant Backgrounds, Versatile Volume and Terrific Tiles"
918,[MrMobile] Moto Z4 Review: Is This The Moto Z “4” U?
919,July 2019 Pixel Factory Images Released
920,Android Central: Huawei begins trademarking its Android replacement OS — HongMeng
921,Bill Gates says Steve Jobs was a master at ‘casting spells’ to keep Apple from dying
922,LG Announces G8S ThinQ With Both Upgrades and Downgrades Over the G8
923,ICE Used Facial Recognition to Mine State Driver’s License Databases
924,Facebook ads funded by 'dark money' are the right's weapon for 2020 - The right and conservative media are using the untraceable ads to push a rightwing agenda and get Donald Trump re-elected
925,"ActionDash 3.0 adds focus mode, app limits, Usage Assistant &amp; much more"
926,I Miss the Big Reveal of New Android Versions
927,I heard #Sony is working on a new #Xperia Smartphone featuring a total of six lenses - Max J. on Twitter
928,YouTube Music and Universal Music Group change the way you see music
929,Stop abuse by Big Tech: Wikipedia co-founder issues ‘Declaration of Digital Independence’
930,"Google Duo 56 preps in-app call history, Low Light mode"
931,"Made by Google on Twitter: ""Can't wait for you to see what's on the inside.… """
932,Want to ensure Q's gesture nav works with 3rd party launchers? Please consider starring these Q Beta bug reports
933,Google Pixel 3a Display Review — Mid-Range With Top-of-the-Line Color Accuracy
934,what android features would oyu like that is not in android already?
935,How my 'SMARTPHONE ONLY' setup with Samsung DeX &amp; G Suite works
936,"How come nobody has attempted a high end Android TV console, with PS4/Xbox One specs and a blu-ray drive?"
937,"Facebook Resolves Day-Long Outages Across Instagram, WhatsApp, &amp; Messenger"
938,Inside the tech-free school where high-tech parents are sending their kids
939,Google's Matías Duarte on the History of Smartphone Notifications
940,I Feel Trapped by Google Hangouts
941,Google just officially teased the Pixel 4
942,The most important thing to check before buying a Chromebook
943,"Pirate our games, don't buy them from key resellers, say indies"
944,India's First CPUs Are Ready for App Development
945,"Facebook Libra: Critics Can Rejoice as the Crypto Continues to Faceplant: ""I can't think of a tech company less well-suited to lead the cryptocurrency revolution."""
946,The Infrastructure Mess Causing Countless Internet Outages
947,Pixel 4 release date teased by leaked Verizon timeline - 9to5Google
948,Huawei Braces for a Steep Drop in Overseas Smartphone Sales
949,The psychedelics evangelist: A German financier wants to turn magic mushrooms into modern medicine
950,The AMD 3rd Gen Ryzen Deep Dive Review: 3700X and 3900X Raising The Bar
951,"Contact Lost With Three Starlink Satellites, Other 57 Healthy"
952,Alleged screenshots of Huawei’s Oak OS revealed in patent filings
953,"Facebook images broken, Instagram and WhatsApp struggling too"
954,An Amazon executive snapped back at John Oliver after his stinging attack on the firm's 'brutal' working conditions
955,[Update: Claim period open] Google and Huawei may pay up to $400 to owners of bootlooping Nexus 6P
956,Bitcoin mining on an Apollo Guidance Computer: 10.3 seconds per hash
957,The Streaming TV Sector Still Doesn't Realize Exclusives Will Drive Users Back To Piracy
958,Would you pay for iMessage?
959,Note10 Live Photo Leak via Slashleaks
960,Is it just me or are Android notifications and Do Not Disturb behavior worse than they used to be?
961,Hacked forensic firm pays ransom after malware attack - Largest private provider Eurofins hands over undisclosed fee to regain control of systems
962,"""AR in Search is all about the details. Bring 🐈 and 🐅 right in front of you at scale and with lighting &amp; shadows that matches your space."""
963,Firstpost: Galaxy Fold ready for launch as most of the display related issues are fixed: Samsung official
964,OnePlus 7 vs OnePlus 7 Pro battery comparison: It all evens out
965,Everything You Need to Know About The Invisible Email Tool That Tracks You: What is a tracking pixel and what is Superhuman up to?
966,Oppo Reno 10x: A Layman's Review
967,Bitwarden Mobile App v2.0 Now Available
968,What are your thoughts on true dark mode in Android Q
969,Myspace Employees Used to Spy on Users
970,US media sector braces for brutal year for jobs
971,"In Android Q, the app switcher will tell you how much time is left on your Digital Wellbeing timers."
972,"Realme 3 Pro available in France, Italy, Spain and United Kingdom for €199"
973,YouTube for Android tests a more personal Home page with topic filters
974,How much better can smartphones really get?
975,Best Smartphones of the first half of 2019.
976,Wikipedia founder calls for social media strike - People are being urged to stop using social media for up to 48 hours later this week in an effort to pressure the networks into restoring control of personal data to users.
977,Jony Ive reportedly felt that Tim Cook wasn’t interested in design
